{
  "schema_version": "1.0",
  "event_id": "evt_demo_001",
  "event_type": "PAYMENT_ATTEMPT_UPDATED",
  "event_time": "2026-08-29T14:03:12Z",
  "received_at": "2026-08-29T14:03:12.150Z",
  "payment_id": "pay_demo_001",
  "attempt_id": "att_demo_001",
  "attempt_sequence": 1,
  "merchant_id": "pago_total_merchant_1",
  "provider_id": "stripe",
  "provider_connection_id": "stripe_br_primary",
  "country": "BR",
  "currency": "BRL",
  "amount_minor": 12990,
  "payment_method_category": "CARD",
  "payment_method_type": "CREDIT_CARD",
  "card": {"brand": "MASTERCARD", "type": "CREDIT", "issuer_bank_id": "itau_br", "issuer_country": "BR", "bin_prefix": "555555"},
  "status": "DECLINED",
  "decline": {"normalized_code": "PROVIDER_TIMEOUT", "category": "PROVIDER", "retryability": "RETRY_LATER", "raw_code": "68", "raw_message": "Response received too late", "mapping_version": "1.0"},
  "timing": {"orchestrator_latency_ms": 31, "provider_latency_ms": 2410, "total_latency_ms": 2441},
  "raw_event_id": "raw_demo_001",
  "normalization_version": "1.0",
  "correlation_id": "corr_demo_001",
  "is_test": true
}
